{
  "summary": "Runtime validation completed for reversible-layer hardening.",
  "gate_status": "completed",
  "next_agent": "Nexusmon Reviewer",
  "changed_files": [
    "core/reversible.py",
    "tests/test_reversible.py"
  ],
  "commands_run": [
    "pytest tests/test_reversible.py --tb=short -q"
  ],
  "runtime_needed": false,
  "tests_status": "Targeted reversible tests passed; full suite pending.",
  "remaining_steps": [
    "Run full pytest suite",
    "Review malformed JSONL handling in runtime logs"
  ],
  "confidence": "medium",
  "artifacts": [
    "artifacts/reversible_validation.log"
  ],
  "suggested_reviewer": "Nexusmon Reviewer"
}
